{
  "$schema": "https://json-schema.org/draft/2020-12/schema",
  "$id": "https://volatoo.org/schemas/build-context-v1.schema.json",
  "title": "Volatoo build context v1",
  "type": "object",
  "additionalProperties": false,
  "required": [
    "schema",
    "target",
    "sources",
    "base",
    "toolchain",
    "config_digest",
    "world_digest"
  ],
  "properties": {
    "schema": {
      "const": "org.volatoo.build-context/v1"
    },
    "target": {
      "type": "object",
      "additionalProperties": false,
      "required": [
        "id",
        "arch",
        "chost",
        "libc",
        "abi",
        "init",
        "profile_id",
        "profile_revision",
        "cpu_class"
      ],
      "properties": {
        "id": {
          "$ref": "#/$defs/identifier"
        },
        "arch": {
          "$ref": "#/$defs/name"
        },
        "chost": {
          "type": "string",
          "minLength": 3,
          "maxLength": 128,
          "pattern": "^[A-Za-z0-9][A-Za-z0-9._+-]+$"
        },
        "libc": {
          "enum": [
            "glibc",
            "musl"
          ]
        },
        "abi": {
          "type": "object",
          "additionalProperties": false,
          "required": [
            "mode",
            "values"
          ],
          "properties": {
            "mode": {
              "enum": [
                "multilib",
                "no-multilib"
              ]
            },
            "values": {
              "type": "array",
              "minItems": 1,
              "uniqueItems": true,
              "items": {
                "$ref": "#/$defs/name"
              }
            }
          }
        },
        "init": {
          "enum": [
            "openrc",
            "systemd"
          ]
        },
        "profile_id": {
          "$ref": "#/$defs/identifier"
        },
        "profile_revision": {
          "$ref": "#/$defs/revision"
        },
        "cpu_class": {
          "$ref": "#/$defs/name"
        }
      }
    },
    "sources": {
      "type": "array",
      "minItems": 1,
      "items": {
        "type": "object",
        "additionalProperties": false,
        "required": [
          "name",
          "revision",
          "tree_digest"
        ],
        "properties": {
          "name": {
            "$ref": "#/$defs/name"
          },
          "revision": {
            "$ref": "#/$defs/revision"
          },
          "tree_digest": {
            "$ref": "#/$defs/digest"
          }
        }
      }
    },
    "base": {
      "type": "object",
      "additionalProperties": false,
      "required": [
        "generation",
        "rootfs_digest"
      ],
      "properties": {
        "generation": {
          "$ref": "#/$defs/name"
        },
        "rootfs_digest": {
          "$ref": "#/$defs/digest"
        }
      }
    },
    "toolchain": {
      "type": "object",
      "additionalProperties": false,
      "required": [
        "portage_version",
        "digest"
      ],
      "properties": {
        "portage_version": {
          "type": "string",
          "minLength": 1,
          "maxLength": 128,
          "pattern": "^[A-Za-z0-9][A-Za-z0-9._+~-]*$"
        },
        "digest": {
          "$ref": "#/$defs/digest"
        }
      }
    },
    "config_digest": {
      "$ref": "#/$defs/digest"
    },
    "world_digest": {
      "$ref": "#/$defs/digest"
    }
  },
  "$defs": {
    "digest": {
      "type": "string",
      "pattern": "^sha256:[0-9a-f]{64}$"
    },
    "revision": {
      "type": "string",
      "pattern": "^[0-9a-f]{40}([0-9a-f]{24})?$"
    },
    "name": {
      "type": "string",
      "minLength": 1,
      "maxLength": 64,
      "pattern": "^[a-z0-9][a-z0-9._+-]*$"
    },
    "identifier": {
      "type": "string",
      "minLength": 3,
      "maxLength": 192,
      "pattern": "^[a-z0-9][a-z0-9._+-]*(/[a-z0-9][a-z0-9._+-]*)+$"
    }
  }
}
