{
  "schema": "org.volatoo.build-context/v1",
  "target": {
    "id": "volatoo/amd64/glibc/systemd/23.0/base-v1",
    "arch": "amd64",
    "chost": "x86_64-pc-linux-gnu",
    "libc": "glibc",
    "abi": {
      "mode": "multilib",
      "values": [
        "amd64",
        "x86"
      ]
    },
    "init": "systemd",
    "profile_id": "volatoo/amd64/glibc/systemd/base-v1",
    "profile_revision": "8888888888888888888888888888888888888888",
    "cpu_class": "generic-amd64"
  },
  "sources": [
    {
      "name": "gentoo",
      "revision": "2222222222222222222222222222222222222222",
      "tree_digest": "sha256:2222222222222222222222222222222222222222222222222222222222222222"
    },
    {
      "name": "volatoo-overlay",
      "revision": "3333333333333333333333333333333333333333",
      "tree_digest": "sha256:3333333333333333333333333333333333333333333333333333333333333333"
    }
  ],
  "base": {
    "generation": "base-v1",
    "rootfs_digest": "sha256:bbbbbbbbbbbbbbbbbbbbbbbbbbbbbbbbbbbbbbbbbbbbbbbbbbbbbbbbbbbbbbbb"
  },
  "toolchain": {
    "portage_version": "3.0.77",
    "digest": "sha256:cccccccccccccccccccccccccccccccccccccccccccccccccccccccccccccccc"
  },
  "config_digest": "sha256:dddddddddddddddddddddddddddddddddddddddddddddddddddddddddddddddd",
  "world_digest": "sha256:eeeeeeeeeeeeeeeeeeeeeeeeeeeeeeeeeeeeeeeeeeeeeeeeeeeeeeeeeeeeeeee"
}
